Intro_text,thisN,thisTrialN,thisRepN,key_resp.keys,key_resp.rt,key_resp.duration,Intros.thisRepN,Intros.thisTrialN,Intros.thisN,Intros.thisIndex,thisRow.t,notes,dateTime,consent.started,text_9.started,button.started,consent.stopped,button.numClicks,button.timesOn,button.timesOff,instructions1.started,Intro_text_show.started,Continue_txt.started,key_resp.started,instructions1.stopped,Intros.key_resp.keys,Intros.key_resp.rt,Intros.key_resp.duration,PROLIFIC_PID,STUDY_ID,SESSION_ID,date,expName,psychopyVersion,expStart,
,,,,,,,,,,,,,2026-04-21_16.06.15,0.04786416600109078,0.0637306249991525,0.0637306249991525,0.36515279099694453,1,[0.3010839170019608],[0.30108716699760407],,,,,,,,,,,,2026-04-21_16h06.10.628,Mood4,2024.2.4,2026-04-21 16h06.16.105274 -0400,
"Welcome to the reward and subjective well-being task!

In this experiment, you will have the opportunity to earn money by playing a decision-making task. You will also be asked to rate your happiness at various points as you progress through the task.",0,0,0,return,1.0819000829942524,0.08824220899259672,0,0,0,0,0.38893620800809003,,,,,,,,,,0.37958149999030866,0.38893620800809003,0.38893620800809003,0.38893620800809003,1.5637503750040196,return,1.0819000829942524,0.08824220899259672,,,,2026-04-21_16h06.10.628,Mood4,2024.2.4,2026-04-21 16h06.16.105274 -0400,
"In the next few steps, we will guide you through the task and how it works, you will then do a minimum of 10 practice trials, and finally, you will start the task.",1,1,0,return,0.07446375000290573,0.07598829199559987,0,1,1,1,1.5742598329961766,,,,,,,,,,1.5668907079962082,1.5742598329961766,1.5742598329961766,1.5742598329961766,1.730143416003557,return,0.07446375000290573,0.07598829199559987,,,,2026-04-21_16h06.10.628,Mood4,2024.2.4,2026-04-21 16h06.16.105274 -0400,
"On each trial, you will have the opportunity to earn money. You will be presented with two options: one option will be a certain reward, the other, a gamble.  The gamble probability will be indicated by the percentage number. The gamble has two possible outcomes: either you win and gain the indicated reward, either you lose and earn $0. ",2,2,0,,,,0,2,2,2,1.7440288749930914,,,,,,,,,,1.7365649580024183,1.7440288749930914,1.7440288749930914,1.7440288749930914,,,,,,,,,,,,
