Intro_text,thisN,thisTrialN,thisRepN,key_resp.keys,key_resp.rt,key_resp.duration,Intros.thisRepN,Intros.thisTrialN,Intros.thisN,Intros.thisIndex,thisRow.t,notes,dateTime,consent.started,text_9.started,button.started,consent.stopped,button.numClicks,button.timesOn,button.timesOff,instructions1.started,Intro_text_show.started,Continue_txt.started,key_resp.started,instructions1.stopped,Intros.key_resp.keys,Intros.key_resp.rt,Intros.key_resp.duration,instructions_t1_target_on_choice.started,fixation_inst_5a.started,gamble1_txt_inst_5a_low.started,gamble1_prob_inst_5a.started,gamble2_txt_inst_5a.started,gamble2_txt_inst_5a_low.started,gamble2_prob_inst_5a.started,choice_inst_5a.started,text_inst_5a.started,LL_line.started,PROLIFIC_PID,STUDY_ID,SESSION_ID,date,expName,psychopyVersion,expStart,
,,,,,,,,,,,,,2026-04-08_15.01.48,0.04872145799890859,0.062398582995228935,0.062398582995228935,1.2240011249959935,1,[1.1611796249999315],[1.1611831249974784],,,,,,,,,,,,,,,,,,,,,,2026-04-08_15h01.44.746,Mood4,2024.2.4,2026-04-08 15h01.49.457201 -0400,
"Welcome to the reward and subjective well-being task!

In this experiment, you will have the opportunity to earn money by playing a gambling task. You will also be asked to rate your happiness at various points as you progress through the task.",0,0,0,return,0.656235917005688,0.10063770799752092,0,0,0,0,1.2459526669990737,,,,,,,,,,1.2420068329956848,1.2459526669990737,1.2459526669990737,1.2459526669990737,2.0048280830014846,return,0.656235917005688,0.10063770799752092,,,,,,,,,,,,,,2026-04-08_15h01.44.746,Mood4,2024.2.4,2026-04-08 15h01.49.457201 -0400,
"In the next few steps, we will guide you through the task and how it works, you will then do a minimum of 10 practice trials, and finally you will start the task.",1,1,0,return,0.07976379100000486,0.10738524999760557,0,1,1,1,2.0143062499992084,,,,,,,,,,2.0084191669957363,2.0143062499992084,2.0143062499992084,2.0143062499992084,2.2048437499979627,return,0.07976379100000486,0.10738524999760557,,,,,,,,,,,,,,2026-04-08_15h01.44.746,Mood4,2024.2.4,2026-04-08 15h01.49.457201 -0400,
"On each trial, you will have the opportunity to earn money. You will be presented with two options, both options will be gambles. Each gamble probability will be indicated by the proportion of the pie that is colored green, each gamble reward size will be indicated by the size of the pie. The probabilities will also be displayed as text. Each gamble has two possible outcomes: either you win and gain the indicated reward, either you lose and earn $0. ",2,2,0,return,0.14700216599885607,0.10250512499624165,0,2,2,2,2.2186370419949526,,,,,,,,,,2.214832249999745,2.2186370419949526,2.2186370419949526,2.2186370419949526,2.47176554199541,return,0.14700216599885607,0.10250512499624165,,,,,,,,,,,,,,2026-04-08_15h01.44.746,Mood4,2024.2.4,2026-04-08 15h01.49.457201 -0400,
"The gamble outcome rewards are BIG or MEDIUM, although a proportion of the gambles will have a SMALL reward with a certain (100%) probability.
You will begin the task with $5. The outcome of the choices you make from then on will count for ADDITIONAL money.
Please select your gamble choice by pressing the LEFT or RIGHT arrow keys. Once you’ve made your choice the outcome will be applied to your total. 
On the next screen, you will do a few introductory trials.",3,3,0,return,2.2746584999986226,0.07554095899831736,0,3,3,3,2.487911416996212,,,,,,,,,,2.4844914579953183,2.487911416996212,2.487911416996212,2.487911416996212,4.8392365830004564,return,2.2746584999986226,0.07554095899831736,,,,,,,,,,,,,,2026-04-08_15h01.44.746,Mood4,2024.2.4,2026-04-08 15h01.49.457201 -0400,
,,,,,,,,,,,,,,,,,,,,,,,,,,,,,4.842035707995819,4.851730624999618,4.851730624999618,4.851730624999618,4.851730624999618,4.851730624999618,4.851730624999618,4.851730624999618,4.851730624999618,4.851730624999618,,,,,,,,
